,Category,Question,Answer
,General,What is Minds?,Minds is the world's leading free and open source social network where you are rewarded for your contributions to the network with crypto tokens. 
,General,What is the goal of Minds?,The goal of Minds is to create a free and open Internet and ensure that people are fairly compensated for their efforts online with viral reach and revenue opportunity.
,General,Who founded Minds?,"Bill Ottman founded Minds in 2011, and he is the current CEO."
,General,How do I contact Minds?,You can contact Minds by emailing info@minds.com.
,General,Can I invest in Minds?,"Minds is currently a privately held company, though it took a major step in becoming community owned when it raised over $1 million from over 1,500 investors worldwide in a SEC Regulation CF equity-crowdfunding campaign. Minds will make all users aware of future investment opportunities when they are available."
,General,Can I use Minds official logo?,"Yes, as long as it is not in an attempt to impersonate or suggest any direct affiliation to Minds."
,General,What is the Minds privacy policy?,You can read the full Minds privacy policy here - https://www.minds.com/p/privacy
,General,Where can I download the mobile app?,You can download the app from the Google Play store or the iOS App Store.
,General,How is my content licensed on Minds?,"There are multiple content licenses to choose from, including GPL, Creative Commons, Public Domain, and All Rights Reserved. While uploading content through Minds.com, you will be prompted to choose a license; make sure to select the appropriate one! All license edits must be made from the Minds web app."
,General,What are the Minds Terms of Service?,"All content legal under US law is permitted on the site. Certain malicious behavior on the site may result in a channel ban such as harassment, bullying, spam, threatening violence, and copyright infringement. Minds full Terms of Service can be found here - https://www.minds.com/p/terms"
,General,Is there a way to filter the content I see?,"You will see 100% of the content that you subscribe to. For any unsubscribed content (Boost or Discovery feeds), you can choose to use either our default feed, Open Feed or explicit feed. Our default feed only contains content that is acceptable under the Apple and Google developer terms of service. This is essential to ensure that our platform remains available on mobile devices. If you wish to view content that is more controversial, you can turn on ""Open"" by clicking on the gear icon in the top right of you feeds. To view explicit content, you can opt-in to explicit mode in your settings. "
,,,
,Security,How do I block a user?,"You may block a user by going to their channel settings and selecting ‘Block’. You may also block a user by clicking the settings on their post (small down carrot icon), and selecting ‘Block User’."
,Security,What does blocking a user do?,"Blocking a user makes it so that user is no longer able to engage with your channel or any of the content or groups you own. You also will no longer see this user’s posts or Boosts, unless you specifically go to their channel."
,Security,How do I report content?,"If you come across content that you believe violates the Minds Terms of Service, you can click on the post options (small down carrot icon) and select ‘Report’. You then will be able to choose the reason for reporting the content. The content is then sent to the Minds admins for review."
,Security,How do I submit an appeal?,"If you wish to appeal a decision by the Minds admins regarding your content, you can do so in the 'Reported Content' section in your settings. "
,Security,How do I enable two factor authentication?,"Click on your account settings. From here, select “Two factor authentication” and enter the phone number you want the security text delivered to. You will receive a code by text every time someone logs into your account."
,Security,Am I required to give any personal information?,"Minds users have the ability to remain anonymous, as you are not required to provide any personal information on signup. You are only required to provide personal information if you wish to participate in our rewards program. To participate in our rewards program, all you need to provide is your mobile device number. This number will be converted into a SHA256 unique hash ID that we will tie to your account to prove uniqueness. We will not store your number on our servers."
,,,
,Channels,How do I create an channel?,"To create a new channel, enter your desired username along with your email address and password at https://minds.com"
,Channels,How do I login?,"Enter your username and password. Please note that your username is your @ handle on Minds, not your email address."
,Channels,Can I change my username?,"You may not change your username after you create it. However, you can change your display name in your settings."
,Channels,How do I request a new password?,"Select the ""Forgot Password?"" link from the login page. At this point, we will send you an email with a link to verify it is you and reset your password."
,Channels,Can I use two factor authentication?,"Yes, you can enable two factor authentication in your settings. "
,Channels,Can I deactivate my account?,"In your account settings, choose “Deactivate channel” on the left-hand side of the screen. Your channel will be removed from Minds, but your content will remain. If you wish to delete your content, please do so before deactivating your account."
,Channels,Can I reactivate my account?,"Yes, all you need to do is login again to reactivate your account."
,Channels,What is a channel?,"A Minds channel is your profile and your home page on the site. Be anonymous if you want as Minds does not require any personally identifiable information to join. You will be asked for a valid email, but this too is optional. Beware, however, that if you do not enter a valid email your channel is not recoverable if you forget your password. From your Minds channel page, you can edit your avatar and banner, write a short bio, view your subscriptions and subscribers, enter status posts, and upload and manage your content. This is the page that other people will see when they visit you on Minds."
,Channels,How do I edit my channel?,"To edit the information and images on your channel, you must first select the ‘edit’ button (notated with a pencil icon). Clicking this button enables you to change your avatar, banner photo, personal bio, social link, and membership rewards."
,Channels,How do I pin a post to my channel?,"You may pin a maximum of three posts to the top of your channel feed. To do so, click on the bookmark icon located on the top of all of your posts. It will be filled in with gray when the post is pinned. Be sure to refresh your page once you have pinned a post to ensure it stays pinned."
,Channels,How do I view my images?,"To view your images, go to the image gallery on your channel page and click ""view all"". You may also click on ""Images"" in the main navigation and then select ""My Images""."
,Channels,How do I view my videos?,"To view your videos, go to the video gallery on your channel and click ""view all"". You can also click on ""Videos"" in the main navigation and then select ""My Videos""."
,Channels,How do I view my posts?,"To view all of your posts, use the main feed on your channel."
,Channels,How do I view my blogs?,"To view your blogs, go to the blog gallery on your channel and click ""view all"". You can also click on ""Blogs"" in the main navigation and then select ""My Blogs""."
,Channels,How do I view my subscribers and subscriptions?,"To view your subscribers and subscriptions, click on the word ""Subscribers"" under your channel photo. From here, you can view both your subscribers and subscriptions. You can also find these lists by clicking on the ""Channels"" icon on the top-bar navigation, and then toggling to the ""Subscribers"" or ""Subscriptions"" lists."
,Channels,How do I update my avatar and banner photo?,"To update your avatar and banner photo, click the pencil icon to edit your channel and then you can click on the avatar/banner areas to upload a new photo. Be sure to save your changes and refresh your browser after saving. Please note that it may take some time for your new avatar / banner to update throughout the entire site. If your avatar does not save properly, consider logging out of all devices and then log back in to synch on the last saved avatar."
,,,
,Posting,What can I upload or post to Minds?,"You can post video files, image files, status posts, hyperlinks, and blogs on Minds."
,Posting,How can I post a thumbnail image with a link?,Add a space after the URL and a image thumbnail will appear. You may then delete the URL and the thumbnail will persist.
,Posting,How do I upload or post to Minds?,"To post, simply type text or hyperlinks into the post entry field and click ‘Post’. To upload media, click on the paperclip icon in your status field. From here, you’ll be prompted to select the media file that you wish to upload. You will need to wait for the upload bar to complete before the ‘Post’ button will be highlighted and able to be clicked."
,Posting,What are the icons on a post for?,"Each post has icons along the bottom of the post for other users to upvote, downvote, Wire, comment, or Remind. You will also see an option to ‘Boost’ on your own post. On the top of your post, you will see icons for post settings, translations (globe), or pinned posts."
,Posting,What is a pinned post?,"You can pin up to 3 posts on your channel so they stay at the very top of your feed. These posts will remain at the top of your channel feed. To pin a post, click on the bookmark icon in the top right of your post."
,Posting,What is a Remind?,"A ‘Remind’ is a way for users to share other people’s content on their own channel. This is a similar feature to a ‘share’ or ‘retweet’. To Remind a post, click on the share icon on the post and submit."
,Posting,How do I delete a post?,"To delete a post, you can click on the post settings and then select ""Delete"". "
,Posting,How do I share a post?,"To share a post outside of Minds, you can click on the post settings and then select ""Share"". From here, you can choose to share the post to another social network or simply copy the link to your clipboard."
,,,
,Voting,How do I vote on something?,"To upvote a post or comment, click on the thumbs up icon. To downvote a post or comment, click on the thumbs down."
,Voting,What can I vote on?,"You can vote on any content on the site, including blogs, videos, status posts, and images. You can also vote on comments."
,Voting,Who does a vote do?,Voting determines which content is deemed the best (or worst) by the community. This enables the system to make this content more discoverable and reward the users for posting it.
,Voting,Is there a limit on how many times I can vote?,"No, there is no limit on how many times you can vote, but using any type of bot or software to manipulate the voting tools is a bannable offense."
,,,
,Commenting,How do I comment on something?,"To comment on a post, click on the speech bubble icon on the bottom of every post. From here, you can enter your comment."
,Commenting,What can I comment on?,"You can comment on any post, image, video or blog on Minds. You can also reply to other user's comments."
,Commenting,Is there a limit on how many times I can comment?,"No, there is no limit on how many times you can comment on something."
,Commenting,Can I upload media into my comments?,"You can currently upload an image file to a comment, or a thumbnail preview for a hyperlink."
,,,
,Images,How do I upload an image?,"To upload an image, click on the paperclip icon in the post entry field and select the image file you wish to upload. When the loading bar has completed, the ‘post’ button will illuminate and you can click it to submit.Make sure to wait for teh Post button to FULLY illuminate as athere can be a delay and clicking prematurely will cause the upload to fail."
,Images,What image file types are supported?,All major image file types are supported.
,Images,Where can I see all of my images?,"To view your images, go to the image gallery on your channel and click ""view all"". You can also click on ""Images"" in the main navigation and then select ""My Images""."
,Images,Are there any limitations to what I can upload?,You may upload any image that adheres to our Terms of Service.
,,,
,Videos,How do I upload a video?,"To upload a video, click on the paperclip icon in the post entry field and select the video file you wish to upload. When the loading bar has completed, the ‘post’ button will illuminate and you can click it to submit."
,Videos,What video file types are supported?,All major video file types are supported.
,Videos,Where can I see all of my videos?,"To view your videos, go to the video gallery on your channel and click ""view all"". You can also click on ""Videos"" in the main navigation and then select ""My Videos""."
,Videos,Are there any limitations to what I can upload?,"Currently, Minds only accepts videos under 30 minutes in length."
,,,
,Blogs,How do I write a blog?,"Click blogs from the navigation bar in the top center of the screen and select “WRITE A NEW BLOG.” A blog will open, and then just start writing."
,Blogs,Where can I view all of my blogs?,"To view your blogs, go to the blog gallery on your channel and click ""view all"". You can also click on ""Blogs"" in the main navigation and then select ""My Blogs""."
,Blogs,How do I save a draft?,"Click ""Save Draft"" at the bottom of the page and your blog will be saved without being published to your channel."
,Blogs,How do I publish a blog?,"To publish a blog, click on ""Publish"" when you are finished writing. This will post the blog to your channel feed and to all of your subscribers. If you need to make an edit after you publish your blog, then make the edit and Remind the blog from your gallery to republish the blog. "
,Blogs,How do I set a banner photo for my blog?,"To set a banner photo for your blog, simply click on the large gray area above the blog and select the photo you wish to set as the banner."
,Blogs,How do I upload media into my blog?,"To upload media into your blog, click on the + icon next to the text cursor. From there, you can choose to upload either an image or video. For images, you can copy an image address, or upload directly from your computer. For videos, you will need to use a link."
,Blogs,How do I format my blog?,"To access the formatting options, you must first highlight the text you wish to format. At this point, all formatting options will appear in the black bar."
,Blogs,How do I monetize a blog?,"There are two ways to monetize your blog. First, you can lock your blog behind a paywall and charge other people on Minds a specified amount to view it. To do this, click on the lightning bolt 'Wire' icon and select the amount you wish to charge. More information on Wire may be found at https://minds.com/wire"
,,,
,Groups,How do I create a group?,"Click the navigation bar in the top-center of the screen and select “Groups.” From there, you will be prompted to “Start a new group."""
,Groups,How do I edit the group settings?,"To edit a group, click on the pencil icon which will open all fields for edit. From here, you can edit the group name, description, banner image, avatar image, associated tags, privacy options, permission options, and default feed."
,Groups,What is the group 'feed'?,"The group feed is where you can see all posts from members of the group. This is the default group setting, but you can navigate to it by clicking on ""feed"" under the avatar."
,Groups,What is the group 'conversation'?,"The group conversation is where you can have a live conversation with all members of the group. You can navigate to this by clicking on ""conversation"" under the avatar."
,Groups,How do I invite people to the group?,"To invite people to the group, click on ""Members"" and you will see the option to search for users who you want to invite. Then, simply enter the name to send them an invitation. You may only send invitations to join a group to your subscribers."
,Groups,How do I promote the group?,"Under the group description, you will see the option to ""Boost"" your group. This will promote the group to the rest of the Minds network."
,Groups,How do I make someone an admin of the group?,"To make someone a group admin, click on ""Members"" and find the user, then click on the gear icon on their channel card and select ""Make Admin""."
,Groups,How do I prevent spam in my group?,"The best way to prevent spam in groups is to moderate the posts. This means that any post that someone submits will have to be approved or rejected by a group admin or owner. If you do not wish to moderate, you will need to manually remove any spam posts by selecting ""Delete"" on the post settings."
,Groups,How do I remove someone from my group?,"To remove a group member, you must search for their username in the members section, click the gear icon on their channel card, and select ""Remove from Group"". "
,,,
,Messenger,What is Messenger?,Minds Messenger is a feature for users to directly communicate with one another in an encrypted chat.
,Messenger,How do I set up Messenger?,Minds requires you to create a password for Messenger before using the feature. This is necessary for your chat to be encrypted. This password should be different than your login password to protect your chat in case your channel is compromised.  
,Messenger,Why do I need a password for Messenger?,"Passwords are required to ensure the privacy of your chats in case your channel is compromised. This password is known only by you, and is the only way to unlock your Messenger private key which is used to decrypt your private messages. Not even Minds has access to the contents of your chat."
,Messenger,What if I forget my password?,"If you forget your password, you can reset it by clicking on the Messenger Settings cog and selecting ‘Re-Key’. However, please note that by resetting your password your chat history will be deleted for your privacy protection. "
,Messenger,My chat is unreadbale and displayed as bubbles,"Your chat history has been destroyed because you have rekeyed your encryption key. Your chat partners, however, still have their chat history with you."
,Messenger,How do I message someone?,"To find a channel to message search for their username in the search box in the window. If you have not entered a messenger password, you will be promoted at this time."
,Messenger,How can I tell if someone is online?,A blue dot will appear in your messenger to indicate a channel is online.
,Messenger,How can I tell if I have a message?,"If another user has messaged you, the Messenger window will flash yellow, and you will see a green dot next to the name of the user who messaged you. You will also receive a notification."
,,,
,Notifications,Where can I find my notifications?,"All of your notifications can be found by clicking on the bell icon in the top navigation. From here, you can see all activity related to your channel. You can also filter the notifications for specific activity, such as comments, tags, wires, subscribers, etc."
,Notifications,What do the icons in my notifications mean?,"Within your notifications window, you can hover over each icon to see what type of notification it resembles."
,Notifications,How can I turn off notifications?,Notifications be tmayurned off or muted in three ways: 1) Mute a post in the post drop down menu 2) mute a group in the settings cog of the group 3) block a user.
,,,
,Plus,What is Plus?,"Become a valued Minds supporter by signing up for Minds Plus. We rely on this income to keep our servers humming, and we really appreciate the support from Minds Plus users. Plus is a paid subscription that provides you with added benefits on Minds across all mobile and web channels. The benefits include: Opt-out of all ads and boosted content on the site; Access to exclusive Minds content; Add a Plus badge on your channel; and Request to become verified. Visit https://minds.com/plus for more information."
,Plus,What does opting out of Boosts mean?,"A typical user will see Boosted, or promoted, content throughout their newsfeed and other areas of the site. Opting out of Boosts makes it so you do not see any Boosted content anywhere on the site."
,Plus,What is exclusive Minds content?,"Periodically throughout the month, the Minds team will post exclusive content for all Plus users to provide a closer look at what is going on behind-the-scenes at our headquarters. Access to monthly hangouts with the Minds team will also be included to provide users with the opportunity to ask questions and discuss ideas. Exclusive Minds content will continue to evolve as the site continues to grow."
,Plus,What is a Plus badge?,"By signing up, you will receive a Plus badge on your profile by default. This is intended to make your profile stand out and allow you to show that you are a supporter of Minds. You may also choose to remove this badge from your channel, if desired."
,Plus,What does it mean to become verified?,Plus provides you with the option to request a verified badge. Submit a request and post your Minds channel link on at least two other social sites so we know it is you. The Minds team will review the submission and verify that you actually are who you claim to be. This helps our community confirm that you are the real channel and not an imposter.
,Plus,What is the cancellation policy?,You may cancel your Plus subscription at any time by going to your settings and then clicking on billing. Refunds and credits will not be issued for partial billing periods.
,,,
,Token,What are Minds tokens?,"Minds tokens are the network's crypto-token. They are built using the ERC-20 utility standard and are issued on the Ethereum blockchain. You earn Minds tokens for your contributions to the network, and can exchange them for more views on your content with Boost or to support other creators with Wire."
,Token,How do I earn Minds tokens?,"You earn Minds tokens for your contributions to the network each day. Contributions include setting up your account, referring new users, posting high quality content, being active on the site, contributing code, finding bugs and more. For more information on how to earn, please visit https://minds.com/wallet/tokens/contributions."
,Token,How do I buy Minds tokens?,"More information on purchasing Minds Tokens will be released in the future. During the Testnet phase users will be provided with a token allocation based on on their previous points balance. Users will also be rewarded tokens based on their conributions, and additional boost views may be purchased seperately."
,Token,How can I use my Minds tokens?,"Minds tokens are accepted as payment for all services on the Minds network, including Boost, Wire, Plus and more. You may exchange your tokens for views on your content with Boost, or you may send them to other channels as a tip or for custom rewards with Wire."
,Token,Can I exchange my Minds tokens?,"The Minds token is a utility token meant for application on the Minds platform. There is the possibility that Minds tokens may be traded on third party exchanges, but we have not encouraged or facilitated this in any way. This information is solely to reduce the number of support inquiries regarding this topic."
,Token,What is the total supply of Minds tokens?,"Information regarding the supply will be released with the rest of the tokenomics in the future.
"
,Token,What percentage of Minds tokens were sold in the token Distribution Event?,Information regarding the token allocation will be released with the rest of the tokenomics in the future.
,Token,What percentage of Minds tokens are reserved for user rewards?,Information regarding the token allocation will be released with the rest of the tokenomics in the future.
,Token,What will the remainder of Minds tokens be allocated towards?,Information regarding the token allocation will be released with the rest of the tokenomics in the future.
,Token,Why do I need Ethereum to execute a transaction?,"A small Ethereum ""gas"" fee is required in order to execute a transaction on the Ethereum blockchain. These fees are the incentive provided for Ethereum miners to fulfill the transaction. OffChain tokens will not require any gas fee. OnChain tokens will require a gas fee, but this fee is waved during the Testnet period."
,Token,How do I get Ethereum?,More information regarding how to get real Ethereum for the main network will be provided in the future when we transition out of the TestNet phase.
,,,
,Rewards,How do I earn rewards?,"To earn rewards you must first provide your mobile number and verify your account. Once you have completed this step, you will begin earning rewards for your contributions to the network each day."
,Rewards,Why do I need to provide my mobile number?,"Your mobile number is required for us to create a unique hash ID for your account. This is essential for us to make sure that all engagement channel's receive is unique to prevent fraud and gaming of the system. All mobile numbers are converted to a unique SHA-256 hash, and your mobile number will never be stored on the Minds servers in raw format. "
